{"format":"splashed-ink-motifs/v1","note":"Motifs boxed by hand in public-domain (CC0) paintings and read by Machine Copy. Each holds the lines and dots its painter drew, in the frame of its blot of ink (LobeKit). No images are included.","lineColumns":["u (along the blot's long axis, -1 fuller end to 1 thinner end)","v (across, in half-widths, positive toward the heavier side)","width (in half-widths)"],"motifs":[{"label":"swallow","zh":"燕","note":"a swallow: dark wash body and wings, a few strokes for tail and wing tips","painting":{"accession":"1981.34","title":"Swallow and Lotus","artist":"Fachang Muqi (Chinese, 1220–1280)","url":"https://clevelandart.org/art/1981.34","license":"CC0 (CMA Open Access)","why":"Muqi, Swallow and Lotus: splashed lotus leaves, a few strokes for stem and bird"},"kind":"wash","f":[0.843,0.106,0.077,0.619,0.623,0,0.098,0.169,0.216,0.102,0.222,0.241,0,0.573,0.433,0.185,0.055,0.655,-0.923],"blotShare":0.042,"lines":[[[-0.216,-1.456,0.027],[-0.193,-1.404,0.074],[-0.158,-1.367,0.084],[-0.123,-1.363,0.082],[-0.088,-1.354,0.084],[-0.053,-1.323,0.084],[-0.018,-1.28,0.084],[0.017,-1.244,0.076],[0.052,-1.251,0.057],[0.088,-1.274,0.034],[0.121,-1.26,0.031],[0.143,-1.197,0.063],[0.168,-1.112,0.07],[0.202,-1.053,0.045],[0.234,-0.995,0.027],[0.253,-0.91,0.046],[0.266,-0.826,0.072],[0.283,-0.753,0.064],[0.313,-0.711,0.027]],[[0.223,0.241,0.095],[0.198,0.321,0.107],[0.174,0.362,0.107],[0.149,0.403,0.098],[0.127,0.45,0.105],[0.107,0.503,0.114],[0.087,0.556,0.119],[0.063,0.597,0.123],[0.026,0.648,0.109],[0.003,0.712,0.085],[-0.015,0.787,0.063],[-0.049,0.849,0.063],[-0.073,0.896,0.072],[-0.094,0.949,0.072],[-0.099,0.976,0.082]],[[0.237,-1.022,0.027],[0.202,-1.053,0.045],[0.168,-1.112,0.095]],[[0.236,-0.995,0.027],[0.214,-1.052,0.035],[0.179,-1.092,0.068],[0.168,-1.112,0.095]],[[0.236,-0.995,0.027],[0.214,-1.046,0.027],[0.186,-1.077,0.052],[0.168,-1.112,0.095]],[[0.236,-0.995,0.027],[0.213,-1.041,0.035],[0.179,-1.083,0.068],[0.168,-1.112,0.095]],[[0.02,-1.403,0.027],[0.05,-1.383,0.031],[0.072,-1.315,0.037],[0.076,-1.259,0.05]],[[0.225,-1.051,0.027],[0.19,-1.071,0.052],[0.168,-1.112,0.095]],[[0.168,-1.112,0.095],[0.19,-1.065,0.053],[0.223,-1.029,0.027],[0.236,-0.995,0.027]],[[0.75,-0.06,0.027],[0.785,-0.05,0.027],[0.82,-0.025,0.027],[0.832,-0.023,0.027]],[[0.179,-1.083,0.082],[0.214,-1.052,0.035],[0.236,-0.995,0.027]]],"dots":[[-0.366,0.298,0.089],[0.375,-0.35,0.056],[-0.521,0.078,0.049],[0.874,0.4,0.046],[-0.316,-0.08,0.041]]},{"label":"lotus flower","zh":"荷花","note":"petals outlined over pale wash","painting":{"accession":"1981.34","title":"Swallow and Lotus","artist":"Fachang Muqi (Chinese, 1220–1280)","url":"https://clevelandart.org/art/1981.34","license":"CC0 (CMA Open Access)","why":"Muqi, Swallow and Lotus: splashed lotus leaves, a few strokes for stem and bird"},"kind":"line","f":[0.142,0.39,0.822,0.446,0,0,0.47,0.448,0.021,0.32,0.913,0.732,0,0.881,0.195,0.087,0.115,0.217,-0.706],"blotShare":0.082,"lines":[[[0.355,0.011,0.031],[0.379,-0.004,0.032],[0.409,-0.011,0.034],[0.433,-0.01,0.031],[0.458,-0.007,0.025],[0.484,-0.005,0.024],[0.508,-0.004,0.02],[0.54,-0.008,0.022],[0.567,-0.018,0.023],[0.6,-0.022,0.032],[0.624,-0.021,0.035],[0.647,-0.021,0.032],[0.679,-0.025,0.031],[0.71,-0.031,0.022],[0.741,-0.036,0.016],[0.772,-0.042,0.015],[0.792,-0.046,0.019]],[[-0.524,0.344,0.01],[-0.548,0.34,0.01],[-0.57,0.335,0.013],[-0.6,0.323,0.015],[-0.627,0.308,0.024],[-0.655,0.295,0.025],[-0.686,0.284,0.019],[-0.713,0.27,0.014],[-0.733,0.249,0.02],[-0.75,0.225,0.029],[-0.767,0.201,0.038],[-0.78,0.173,0.041],[-0.776,0.14,0.036],[-0.761,0.112,0.021],[-0.744,0.087,0.013],[-0.725,0.066,0.019]]],"dots":[[-0.883,-0.227,0.025]]},{"label":"lotus leaf","zh":"荷叶","note":"one broad wash, veins radiating from a dark centre","painting":{"accession":"1981.34","title":"Swallow and Lotus","artist":"Fachang Muqi (Chinese, 1220–1280)","url":"https://clevelandart.org/art/1981.34","license":"CC0 (CMA Open Access)","why":"Muqi, Swallow and Lotus: splashed lotus leaves, a few strokes for stem and bird"},"kind":"wash","f":[1.037,0.227,0.343,0.351,0.307,0.287,0.279,0.183,0.169,0.483,0.292,0.151,0.203,0.213,0.168,0.094,0.443,0.731,-0.023],"blotShare":0.355,"lines":[[[0.354,-0.376,0.015],[0.37,-0.372,0.026],[0.386,-0.366,0.03],[0.403,-0.378,0.035],[0.419,-0.386,0.046],[0.435,-0.389,0.046],[0.451,-0.401,0.046],[0.467,-0.409,0.039],[0.484,-0.418,0.028],[0.5,-0.436,0.03],[0.516,-0.448,0.042],[0.532,-0.45,0.046],[0.548,-0.462,0.039],[0.564,-0.471,0.026],[0.58,-0.486,0.024],[0.596,-0.513,0.037],[0.612,-0.537,0.04],[0.628,-0.555,0.038],[0.644,-0.564,0.039],[0.66,-0.579,0.046],[0.676,-0.593,0.047],[0.693,-0.602,0.04],[0.709,-0.614,0.027],[0.725,-0.62,0.023],[0.741,-0.631,0.027],[0.757,-0.645,0.03],[0.762,-0.656,0.046]],[[0.93,0.901,0.015],[0.929,0.855,0.03],[0.928,0.809,0.045],[0.923,0.763,0.053],[0.91,0.732,0.054],[0.893,0.713,0.048],[0.877,0.709,0.046],[0.861,0.712,0.046],[0.844,0.721,0.035],[0.828,0.732,0.035],[0.812,0.735,0.043],[0.796,0.744,0.035],[0.78,0.752,0.028],[0.763,0.74,0.032],[0.746,0.724,0.041],[0.73,0.717,0.041],[0.714,0.72,0.037],[0.697,0.726,0.037],[0.681,0.74,0.046]],[[0.222,1.198,0.015],[0.237,1.171,0.053],[0.253,1.132,0.068],[0.263,1.102,0.071],[0.274,1.076,0.071],[0.284,1.05,0.069],[0.294,1.024,0.069],[0.305,0.997,0.069],[0.315,0.968,0.069],[0.325,0.936,0.071],[0.336,0.903,0.071],[0.346,0.871,0.066],[0.356,0.838,0.061],[0.366,0.806,0.058],[0.377,0.774,0.061],[0.387,0.741,0.066],[0.397,0.709,0.071],[0.406,0.677,0.071],[0.407,0.661,0.071]],[[-0.532,-0.773,0.015],[-0.539,-0.818,0.026],[-0.544,-0.863,0.038],[-0.547,-0.906,0.047],[-0.563,-0.922,0.037],[-0.578,-0.922,0.037],[-0.592,-0.954,0.039],[-0.607,-0.961,0.03],[-0.623,-0.952,0.032],[-0.639,-0.94,0.038],[-0.656,-0.937,0.033],[-0.672,-0.935,0.035],[-0.688,-0.923,0.048],[-0.704,-0.92,0.05],[-0.721,-0.942,0.042],[-0.738,-0.955,0.03],[-0.754,-0.937,0.015]],[[0.691,-1.214,0.046],[0.678,-1.23,0.046],[0.675,-1.273,0.047],[0.677,-1.319,0.047],[0.678,-1.366,0.046],[0.684,-1.41,0.043],[0.698,-1.436,0.034],[0.711,-1.457,0.031],[0.724,-1.477,0.031],[0.741,-1.465,0.034],[0.758,-1.44,0.041],[0.772,-1.411,0.043],[0.78,-1.366,0.047],[0.775,-1.329,0.047],[0.76,-1.317,0.046],[0.744,-1.314,0.046]],[[-0.143,-0.65,0.028],[-0.159,-0.666,0.043],[-0.17,-0.692,0.043],[-0.177,-0.737,0.043],[-0.186,-0.782,0.047],[-0.188,-0.828,0.036],[-0.185,-0.874,0.032],[-0.193,-0.91,0.034],[-0.208,-0.926,0.037],[-0.225,-0.929,0.046],[-0.241,-0.927,0.049],[-0.258,-0.933,0.049],[-0.274,-0.937,0.046],[-0.279,-0.936,0.046]],[[-0.092,-0.828,0.028],[-0.108,-0.843,0.044],[-0.125,-0.871,0.051],[-0.137,-0.894,0.048],[-0.148,-0.917,0.037],[-0.165,-0.945,0.027],[-0.179,-0.983,0.034],[-0.191,-1.027,0.046],[-0.204,-1.071,0.05],[-0.213,-1.1,0.051],[-0.223,-1.129,0.048],[-0.235,-1.153,0.042],[-0.24,-1.158,0.028]],[[0.405,0.831,0.015],[0.421,0.797,0.047],[0.437,0.773,0.063],[0.447,0.747,0.069],[0.457,0.718,0.069],[0.468,0.691,0.069],[0.483,0.655,0.069],[0.494,0.629,0.069],[0.504,0.6,0.063],[0.514,0.567,0.053],[0.524,0.535,0.038],[0.535,0.502,0.015]],[[-0.724,-0.834,0.015],[-0.708,-0.809,0.03],[-0.691,-0.809,0.039],[-0.675,-0.821,0.039],[-0.659,-0.829,0.033],[-0.643,-0.832,0.024],[-0.626,-0.831,0.029],[-0.61,-0.825,0.023],[-0.595,-0.833,0.035],[-0.587,-0.872,0.039],[-0.584,-0.918,0.046],[-0.585,-0.933,0.046]],[[-0.399,-0.379,0.015],[-0.415,-0.376,0.017],[-0.432,-0.383,0.017],[-0.448,-0.389,0.015],[-0.465,-0.399,0.017],[-0.481,-0.409,0.029],[-0.496,-0.419,0.046],[-0.51,-0.45,0.052],[-0.526,-0.466,0.046]],[[0.146,-0.927,0.028],[0.147,-0.973,0.046],[0.153,-1.02,0.051],[0.165,-1.068,0.052],[0.181,-1.099,0.049],[0.197,-1.104,0.047],[0.213,-1.104,0.051],[0.23,-1.103,0.051],[0.246,-1.112,0.046],[0.262,-1.115,0.046]],[[-0.43,-0.82,0.046],[-0.425,-0.867,0.045],[-0.426,-0.913,0.038],[-0.427,-0.959,0.039],[-0.428,-1.005,0.046],[-0.435,-1.043,0.03],[-0.447,-1.078,0.023],[-0.455,-1.123,0.023],[-0.462,-1.159,0.03],[-0.475,-1.169,0.049],[-0.486,-1.164,0.053]],[[-0.349,-0.894,0.046],[-0.351,-0.94,0.034],[-0.359,-0.982,0.035],[-0.373,-0.998,0.038],[-0.389,-0.986,0.039],[-0.406,-0.977,0.047],[-0.422,-0.972,0.048],[-0.438,-0.96,0.048],[-0.454,-0.963,0.039],[-0.471,-0.982,0.02],[-0.477,-0.981,0.015]],[[-0.444,-0.725,0.028],[-0.461,-0.732,0.032],[-0.477,-0.748,0.042],[-0.494,-0.742,0.043],[-0.51,-0.73,0.039],[-0.526,-0.718,0.035],[-0.542,-0.703,0.036],[-0.558,-0.704,0.038],[-0.575,-0.729,0.035],[-0.586,-0.733,0.046]],[[0.708,-0.094,0.015],[0.707,-0.14,0.022],[0.704,-0.186,0.037],[0.704,-0.232,0.037],[0.704,-0.278,0.033],[0.71,-0.316,0.04],[0.725,-0.328,0.046],[0.742,-0.33,0.035],[0.758,-0.339,0.03],[0.768,-0.35,0.046]],[[0.245,-1.45,0.028],[0.229,-1.435,0.034],[0.212,-1.427,0.039],[0.197,-1.406,0.047],[0.181,-1.385,0.047],[0.164,-1.376,0.046],[0.148,-1.376,0.051],[0.138,-1.402,0.051],[0.138,-1.448,0.046],[0.141,-1.464,0.046]],[[-0.554,-1.046,0.046],[-0.556,-1.092,0.028],[-0.564,-1.137,0.023],[-0.577,-1.181,0.031],[-0.586,-1.225,0.03],[-0.591,-1.271,0.033],[-0.596,-1.316,0.038],[-0.606,-1.36,0.039],[-0.61,-1.391,0.028]],[[0.32,-1.247,0.046],[0.308,-1.276,0.04],[0.305,-1.321,0.041],[0.306,-1.368,0.049],[0.312,-1.415,0.043],[0.322,-1.459,0.031],[0.337,-1.48,0.021],[0.353,-1.486,0.015],[0.369,-1.516,0.015]],[[-0.177,-0.737,0.046],[-0.187,-0.766,0.048],[-0.202,-0.779,0.044],[-0.221,-0.761,0.043],[-0.237,-0.777,0.047],[-0.244,-0.819,0.047],[-0.245,-0.865,0.047],[-0.247,-0.91,0.05],[-0.258,-0.939,0.053]],[[0.75,-0.193,0.015],[0.738,-0.219,0.033],[0.722,-0.235,0.043],[0.708,-0.248,0.042],[0.701,-0.293,0.043],[0.688,-0.306,0.049],[0.671,-0.297,0.036],[0.655,-0.286,0.023],[0.639,-0.283,0.015]],[[-0.399,-1.44,0.015],[-0.382,-1.43,0.035],[-0.368,-1.402,0.056],[-0.354,-1.37,0.061],[-0.337,-1.345,0.06],[-0.32,-1.326,0.045],[-0.303,-1.32,0.038],[-0.289,-1.339,0.053],[-0.288,-1.35,0.053]],[[-0.174,-0.307,0.015],[-0.19,-0.304,0.026],[-0.207,-0.296,0.026],[-0.223,-0.287,0.02],[-0.239,-0.297,0.015],[-0.245,-0.296,0.015]],[[0.532,0.072,0.046],[0.515,0.054,0.037],[0.49